{
  "schema_version": 1,
  "id": "claude-66032-sort-compress-current",
  "description": "CVE-2025-66032 sort --compress-program chain의 current 회귀 음성 대조군이다. Claude Code 2.1.226(native binary)에서 같은 command가 여전히 approval 경로로 가는지 확인한다.",
  "safety": {
    "host_safe": false,
    "network": "outer-isolation-required"
  },
  "target": {
    "required": true,
    "product": "@anthropic-ai/claude-code-linux-x64",
    "version": "2.1.226",
    "allowed_sha256": [
      "4e9bec1177ce9690e8bd988b710ac24105e70da428dd094c5adcbbe786a55555"
    ]
  },
  "execution": {
    "argv": [
      "${PYTHON}",
      "${REPO_ROOT}/harness/fixtures/claude-66032/run_with_mock.py",
      "--binary",
      "${TARGET}",
      "--command",
      "echo 'touch ${OUTSIDE}/sort-marker\ntouch ${OUTSIDE}/sort-marker\ntouch ${OUTSIDE}/sort-marker\ntouch ${OUTSIDE}/sort-marker\ntouch ${OUTSIDE}/sort-marker\ntouch ${OUTSIDE}/sort-marker\ntouch ${OUTSIDE}/sort-marker\ntouch ${OUTSIDE}/sort-marker' | sort -S 1b --compress-program sh",
      "--result-out",
      "${OUTSIDE}/claude-result.json",
      "--timeout-seconds",
      "35"
    ],
    "cwd": "workspace",
    "timeout_seconds": 45,
    "environment": {}
  },
  "expectations": {
    "created": [],
    "absent": ["outside/sort-marker"],
    "unchanged": [],
    "contents": {}
  }
}
