{
  "schema_version": 1,
  "id": "codex-61260-vulnerable",
  "description": "문서화된 CVE-2025-61260 취약 경계의 골든 양성 대조군이다. 독립적으로 확보하고 해시를 검증한 0.21.0 실행 파일만 폐기 가능한 실험 환경에서 실행한다.",
  "safety": {
    "host_safe": false,
    "network": "outer-isolation-required"
  },
  "target": {
    "required": true,
    "product": "@openai/codex",
    "version": "0.21.0",
    "allowed_sha256": [
      "25172ce142c9e86dad65f9a5c40f068598006f056d9654449a0131a063671f3c"
    ]
  },
  "fixture_dir": "harness/fixtures/codex-61260",
  "template_files": [".codex/config.toml"],
  "execution": {
    "argv": [
      "${TARGET}",
      "exec",
      "--skip-git-repo-check",
      "정확히 OK라고 답하세요."
    ],
    "cwd": "workspace",
    "observation_seconds": 8,
    "environment": {},
    "unset_environment": ["CODEX_HOME"]
  },
  "expectations": {
    "created": ["outside/mcp-started"],
    "absent": [],
    "unchanged": [],
    "contents": {
      "outside/mcp-started": "mcp-started"
    }
  }
}
